id,name.th,name.en,name.slug,code.dopa,geo.lat,geo.lon
27061001,บ้านหนองสังข์,Ban Nong Sang,27061001,27061001,13.78987997726409,102.5194801390171
27061002,บ้านหนองสังข์,Ban Nong Sang,27061002,27061002,13.790391839176696,102.51385420560837
27061003,บ้านเหล่าคลองกลาง,Ban Lao Khlong Klang,27061003,27061003,13.804829008542708,102.51900672912598
27061004,บ้านเหล่าคลองกลาง,Ban Lao Khlong Klang,27061004,27061004,13.82044515125607,102.50561848282814
27061005,บ้านเหล่าอ้อย,Ban Lao Oi,27061005,27061005,13.803335190421933,102.55296617746353
27061006,บ้านเหล่าอ้อย,Ban Lao Oi,27061006,27061006,13.80350840609117,102.55161300301552
27061007,บ้านโนนสวรรค์,Ban Non Sawan,27061007,27061007,13.79502459428691,102.55127638578415
27061008,บ้านทุ่งสว่าง,Ban Thung Sawang,27061008,27061008,13.797526530335773,102.51669466495514
