id,name.th,name.en,name.slug,code.dopa,geo.lat,geo.lon
130301100,ชุมชนรังสิต-นครนายก17,Chumchon Rangsit - Nakhon Nayok 17,130301100,130301100,13.990663374040642,100.63165292143822
130301101,ชุมชนเสนาวิลล่า91,Chumchon Sena Willa 91,130301101,130301101,13.99749650814953,100.63375443220139
130301102,ชุมชนเก็บสมบัติเจริญผล23,Chumchon Kep Sombat Charoen Phon 23,130301102,130301102,13.992584115555387,100.63465297222137
130301103,ชุมชนณัฐวรรณ,Chumchon Natthawan,130301103,130301103,14.004285196837168,100.64074963331223
130301104,ชุมชนร่วมมิตร,Chumchon Ruam Mit,130301104,130301104,13.993416952417764,100.6240662932396
130301105,ชุมชนคลอง2สามัคคี,Chumchon Khlong 2 Samakkhi,130301105,130301105,13.994265401869079,100.6414470076561
130301106,ชุมชนรัตนปทุม,Chumchon Rattana Pathum,130301106,130301106,13.993977814292348,100.64071744680405
130301107,ชุมชนหมู่บ้านทัศนีย์คลอง1,Chumchon Mu Ban Thatsani Khlong 1,130301107,130301107,13.998386583414668,100.63472002744675
130301108,ชุมชนหมู่บ้านเปรมปรีด์คันทรีโฮม,Chumchon Mu Ban Prem Pri Khanthri Hom,130301108,130301108,13.98362442199298,100.65405607223511
130301109,ชุมชนหมู่บ้านธารารินทร์,Chumchon Mu Ban Thararin,130301109,130301109,13.977648496306827,100.65534353256226
130301110,ชุมชนกุศลสามัคคี,Chumchon Kuson Samakkhi,130301110,130301110,13.992567198525355,100.65629705786705
130301111,ชุมชนหมู่บ้านนฐดา,Chumchon Mu Ban Nathada,130301111,130301111,14.094931425658602,100.64098834991455
130301112,ชุมชนหมู่บ้านวรุณพร,Chumchon Mu Ban Warun Phon,130301112,130301112,13.991963389869335,100.655118227005
130301113,ชุมชนชมฟ้า-วรางกูล,Chumchon Chom Fa - Warangkun,130301113,130301113,13.992931,100.660262
130301114,ชุมชนหมู่บ้านเมลาวิลล์,Chumchon Mu Ban Mela Win,130301114,130301114,13.976295042109808,100.64471125602722
130301115,ชุมชนหมู่บ้านพฤกษาวิลล์7,Chumchon Mu Ban Phruksa Win 7,130301115,130301115,13.992286115382752,100.65629839897156
130301116,ชุมชนซอยดี,Chumchon Soi Di,130301116,130301116,13.996247273893557,100.644671022892
130301117,ชุมชนซอยเกลียวทอง,Chumchon Soi Kliao Thong,130301117,130301117,13.994961596549372,100.64743503928185
130301118,ชุมชนรณชัย,Chumchon Ronnachai,130301118,130301118,13.993956993458356,100.64744040369987
130301119,ชุมชนหมู่บ้านศรีประจักษ์,Chumchon Mu Ban Si Prachak,130301119,130301119,13.99551594818889,100.6503975391388
130301120,ชุมชนอยู่เจริญ,Chumchon Yu Charoen,130301120,130301120,13.996248575182774,100.65224424004555
130301121,ชุมชนซอยคุ้มเกล้าอยู่เจริญ,Chumchon Soi Khum Klao Yu Charoen,130301121,130301121,13.998576569793851,100.65418481826782
130301122,ชุมชนซอยปทุมเจริญสุข,Chumchon Soi Pathum Charoen Suk,130301122,130301122,13.999756824124194,100.65509274601936
130301123,ชุมชนหมู่บ้านพงษ์ศิริ1,Chumchon Mu Ban Phongsiri 1,130301123,130301123,13.994741677336117,100.6580176949501
130301124,ชุมชนวราธร,Chumchon Warathon,130301124,130301124,14.003121882021228,100.65796941518784
130301125,ชุมชนบ้านฟ้ารังสิตคลองสอง,Chumchon Ban Fa Rangsit Khlong Song,130301125,130301125,13.996940860001091,100.65785273909569
130301126,ชุมชนซอยรังสิต-นครนายก61,Chumchon Soi Rangsit - Nakhon Nayok 61,130301126,130301126,13.997361174766384,100.65531805157661
130301127,ชุมชนช้างทอง,Chumchon Chang Thong,130301127,130301127,13.994858794103086,100.64698711037636
130301130,ชุมชนภักดีราชา,Chumchon Phakdi Racha,130301130,130301130,13.998771761115764,100.65010115504265
130301131,ริมคลอง39,Rim Khlong 39,130301131,130301131,13.974749,100.622074
130301132,ร่วมมิตรร่วมใจ,Ruam Mit Ruam Chai,130301132,130301132,13.978002397,100.631423266
130301133,กำนันสังวาลย์,Kamnan Sangwan,130301133,130301133,14.09502507810063,100.66470980644226
13030149,ชุมชนบ้านมั่นคงนครรังสิต,Chumchon Ban Mankhong Nakhon Rangsit,13030149,13030149,13.995112546893507,100.65016284584999
13030150,ชุมชนเดชาพัฒนา,Chumchon Decha Phatthana,13030150,13030150,13.97155658833135,100.609370470047
13030151,ชุมชนเดชาพัฒนา87,Chumchon Decha Phatthana 87,13030151,13030151,13.972494916638604,100.6059841811657
13030152,ชุมชนสินสมุทร,Chumchon Sin Samut,13030152,13030152,13.973634,100.610788
13030153,ชุมชนกรุงเทพเมืองใหม่,Chumchon Krung Thep Mueang Mai,13030153,13030153,13.976382236033455,100.61610549688339
13030154,ชุมชนชลประทานรังสิต,Chumchon Chonprathan Rangsit,13030154,13030154,13.982097920890238,100.61531960964203
13030155,ชุมชนซอยเจริญสิน,Chumchon Soi Charoen Sin,13030155,13030155,13.975060008211535,100.6219057738781
13030156,ชุมชนรังสิตใต้,Chumchon Rangsit Tai,13030156,13030156,13.974544649641539,100.61950117349625
13030157,ชุมชนศาลเจ้าตลาดคลองหนึ่ง,Chumchon San Chao Talat Khlong Nueng,13030157,13030157,13.983870379023807,100.61993166804314
13030158,ชุมชนสุขเกษม,Chumchon Suk Kasem,13030158,13030158,13.987384022182875,100.63247233629227
13030159,ชุมชนธัญญารักษ์,Chumchon Thanyarak,13030159,13030159,13.978709130332152,100.61953738331795
13030160,ชุมชนหมู่บ้านปรีชารังสิต,Chumchon Mu Ban Pricha Rangsit,13030160,13030160,13.968590612826432,100.60919478535652
13030161,ชุมชนประตูน้ำจุฬาลงกรณ์,Chumchon Pratu Nam Chulalongkon,13030161,13030161,13.986620134698617,100.60501456260681
13030162,ชุมชนคลองหนึ่งพัฒนา,Chumchon Khlong Nueng Phatthana,13030162,13030162,13.987296832427916,100.62048822641373
13030163,ชุมชนตลาดสุชาติ,Chumchon Talat Suchat,13030163,13030163,13.983119493507855,100.60615316033363
13030164,ชุมชนตลาดรังสิต,Chumchon Talat Rangsit,13030164,13030164,13.98610740470889,100.61458870768547
13030165,ชุมชนตลาดพรพัฒน์,Chumchon Talat Phon Phat,13030165,13030165,13.98462646750914,100.60687735676765
13030166,ชุมชนหมู่บ้านสร้างบุญ,Chumchon Mu Ban Sang Bun,13030166,13030166,13.98556864658481,100.60906201601028
13030167,ชุมชนหมู่บ้านรัตนโกสินทร์กลุ่ม1,Chumchon Mu Ban Rattanakosin Klum 1,13030167,13030167,13.72706875088845,100.5340875685215
13030168,ชุมชนหมู่บ้านรัตนโกสินทร์กลุ่ม2,Chumchon Mu Ban Rattanakosin Klum 2,13030168,13030168,13.99046297054639,100.60631543397903
13030169,ชุมชนหมู่บ้านรัตนโกสินทร์กลุ่ม3,Chumchon Mu Ban Rattanakosin Klum 3,13030169,13030169,13.993943980436134,100.60554698109627
13030170,ชุมชนหมู่บ้านรัตนโกสินทร์กลุ่ม4,Chumchon Mu Ban Rattanakosin Klum 4,13030170,13030170,13.989134316988805,100.60474365949631
13030171,ชุมชนหมู่บ้านรัตนโกสินทร์กลุ่ม5,Chumchon Mu Ban Rattanakosin Klum 5,13030171,13030171,13.993632968986217,100.60436680912971
13030172,ชุมชนแก้วกาญจน์,Chumchon Kaeo Kan,13030172,13030172,13.99362516116198,100.61029985547066
13030173,ชุมชนรังสิต-ปทุมธานี21ซอย1(รักษ์สันติพัฒนา),Chumchon Rangsit - Pathum Thani 21 Soi 1 (Rak Santi Phatthana),13030173,13030173,13.985307075156546,100.60797035694122
13030174,ชุมชนรังสิต-ปทุมธานี2,Chumchon Rangsit - Pathum Thani 2,13030174,13030174,13.99481715259278,100.61161279678345
13030175,ชุมชนซอยรังสิต-ปทุมธานี4,Chumchon Soi Rangsit - Pathum Thani 4,13030175,13030175,13.990101202757408,100.6109020113945
13030176,ชุมชนร่วมใจ,Chumchon Ruam Chai,13030176,13030176,13.96789954415756,100.62502920627594
13030177,ชุมชนซอย1ซอย2พหลโยธิน94,Chumchon Soi 1 Soi 2 Phahon Yothin 94,13030177,13030177,13.971366579637202,100.6246443092823
13030178,ชุมชนโกลเด้นท์คอนโดทาวน์โครงการ1,Chumchon Konden Khondo Thao Khrongkan 1,13030178,13030178,13.977211227359506,100.62345743179321
13030179,ชุมชนโกลเด้นท์คอนโดทาวน์โครงการ2,Chumchon Konden Khondo Thao Khrongkan 2,13030179,13030179,13.72706875088845,100.5340875685215
13030180,ชุมชนซอย39(ปากคลองหนึ่ง),Chumchon Soi 39 (Pak Khlong Nueng),13030180,13030180,13.984207430824226,100.62197685241699
13030181,ชุมชนซอย40,Chumchon Soi 40,13030181,13030181,13.983003,100.622867
13030182,ชุมชนซอย43,Chumchon Soi 43,13030182,13030182,13.983611,100.62387
13030183,ชุมชนซอย51,Chumchon Soi 51,13030183,13030183,13.979587565855324,100.6262294948101
13030184,ชุมชนซอย53,Chumchon Soi 53,13030184,13030184,13.979569346485922,100.62622681260109
13030185,ชุมชนซอย54,Chumchon Soi 54,13030185,13030185,13.978664883120809,100.62631130218506
13030186,ชุมชนซอย60,Chumchon Soi 60,13030186,13030186,13.979336398707252,100.62720447778702
13030187,ชุมชนซอย61,Chumchon Soi 61,13030187,13030187,13.979741129054341,100.62760546803474
13030188,ชุมชนซอย64,Chumchon Soi 64,13030188,13030188,13.72706875088845,100.5340875685215
13030189,ชุมชนซอย78,Chumchon Soi 78,13030189,13030189,13.983859968149535,100.61772421002388
13030190,ชุมชนซอย83,Chumchon Soi 83,13030190,13030190,13.983091,100.629572
13030191,ชุมชนซอยสายเงิน,Chumchon Soi Sai Ngoen,13030191,13030191,13.98840947532815,100.63848853111267
13030192,ชุมชนคุ้มเกล้าเจริญสุข(ไทเทยิ่น),Chumchon Khum Klao Charoen Suk (Thai Teyin),13030192,13030192,13.981032096981044,100.63947424292564
13030193,ชุมชนบ้านฟ้าลากูน,Chumchon Ban Fa Lakun,13030193,13030193,13.98070154741536,100.64066380262375
13030194,ชุมชนสร้างสรรค์นครรังสิต,Chumchon Sangsan Nakhon Rangsit,13030194,13030194,13.985232898130207,100.6310024857521
13030195,ชุมชนบ้านเอื้ออาทรรังสิตคลองหนึ่ง,Chumchon Ban Uea Athon Rangsit Khlong Nueng,13030195,13030195,13.985006,100.628073
13030196,ชุมชนม.ร.ว.สุวพรรณ,Chumchon Mo Ro Wo Suwaphan,13030196,13030196,13.999709978422842,100.6350177526474
13030197,ชุมชนรังสิตนิมิตใหม่พัฒนา,Chumchon Rangsit Nimit Mai Phatthana,13030197,13030197,13.992351180955588,100.62120839953423
13030198,ชุมชนมิตรสัมพันธ์,Chumchon Mit Samphan,13030198,13030198,13.987856407892604,100.62445521354675
13030199,ชุมชนรังสิต-นครนายก15,Chumchon Rangsit - Nakhon Nayok 15,13030199,13030199,13.990036136547939,100.62779858708382
