id,name.th,name.en,name.slug,code.dopa,geo.lat,geo.lon
46010801,บ้านหนองทุ่ม,Ban Nong Thum,46010801,46010801,16.533048055084134,103.46765175461769
46010802,บ้านนาสัมพันธ์,Ban Na Samphan,46010802,46010802,16.55100271308431,103.46770271658897
46010803,บ้านสว่างนาโพธิ์,Ban Sawang Na Pho,46010803,46010803,16.553262675466215,103.47074165940285
46010804,บ้านบึงวิชัย,Ban Bueng Wichai,46010804,46010804,16.513519214991973,103.48515316843987
46010805,บ้านบึงวิชัย,Ban Bueng Wichai,46010805,46010805,16.513519214991973,103.48515316843987
46010806,บ้านหนองแสงจันทร์,Ban Nong Saeng Chan,46010806,46010806,16.513519214991973,103.48515316843987
46010807,บ้านท่าไคร้,Ban Tha Khrai,46010807,46010807,16.49124294813922,103.49348410964012
46010808,บ้านโนนหัวบึง,Ban Non Hua Bueng,46010808,46010808,16.513519214991973,103.48515316843987
46010809,บ้านลาดสมบูรณ์,Ban Lat Sombun,46010809,46010809,16.495509635652322,103.49539518356323
