id,name.th,name.en,name.slug,code.dopa,geo.lat,geo.lon
13010201,บ้านคลองบ้านใหม่,Ban Khlong Ban Mai,13010201,13010201,13.95753586840198,100.55342361330986
13010202,บ้านบางตะองค์,Ban Bang Ta Ong,13010202,13010202,13.963017755211723,100.54160445928574
13010203,บ้านคลองรังสิตฝั่งใต้,Ban Khlong Rangsit Fang Tai,13010203,13010203,13.968805351256112,100.56454941630363
13010204,บ้านคลองรังสิตฝั่งเหนือ,Ban Khlong Rangsit Fang Nuea,13010204,13010204,13.97203551365938,100.5623996257782
13010205,บ้านบางกะตัน,Ban Bang Katan,13010205,13010205,13.72706875088845,100.5340875685215
13010206,บ้านบางสาน,Ban Bang San,13010206,13010206,13.962788695125406,100.5423541367054
