id,name.th,name.en,name.slug,code.dopa,geo.lat,geo.lon
73040601,บ้านดอนรวกเล็ก,Ban Don Ruak Lek,73040601,73040601,13.875622649797952,100.10024294257164
73040602,บ้านสวนใหม่,Ban Suan Mai,73040602,73040602,13.889588452835875,100.11673048138618
73040603,บ้านสระสี่เหลี่ยม,Ban Sa Si Liam,73040603,73040603,13.894225741350901,100.12316778302193
73040604,บ้านห้วยกรด,Ban Huai Krot,73040604,73040604,13.890667717771313,100.13660296797752
73040605,บ้านดอนรวกใหญ่,Ban Don Ruak Yai,73040605,73040605,13.869485085781674,100.10189518332481
