id,name.th,name.en,name.slug,code.dopa,geo.lat,geo.lon
62050501,บ้านใหม่สุขสมบูรณ์,Ban Mai Suk Sombun,62050501,62050501,16.197599461083122,99.75864216685295
62050502,บ้านแม่ลาดใหญ่,Ban Mae Lat Yai,62050502,62050502,16.162161828819556,99.75868910551071
62050503,บ้านแม่ลาดน้อย,Ban Mae Lat Noi,62050503,62050503,16.140329888203002,99.79307234287262
62050504,บ้านท่ามะขาม,Ban Tha Makham,62050504,62050504,16.145685042556625,99.78198543190956
62050505,บ้านเกาะแตง,Ban Ko Daeng,62050505,62050505,16.16790409968453,99.7888907790184
62050506,บ้านห้วยน้อย,Ban Huai Noi,62050506,62050506,16.145344955272616,99.74529817700386
