id,name.th,name.en,name.slug,code.dopa,geo.lat,geo.lon
20040501,บ้านห้วยลึก,Ban Huai Luek,20040501,20040501,12.951855231986048,101.04668721556664
20040502,บ้านมาบเจริญ,Ban Map Charoen,20040502,20040502,12.921408461608156,101.04040414094925
20040503,บ้านเขาไม้แก้ว,Ban Khao Mai Kaeo,20040503,20040503,12.946171088847695,101.03856414556503
20040504,บ้านห้วยไข่เน่า,Ban Huai Khai Mao,20040504,20040504,12.936187908877018,101.06306076049805
20040505,บ้านภูไทร,Ban Phu Sai,20040505,20040505,12.966146704234038,101.08130112290382
