id,name.th,name.en,name.slug,code.dopa,geo.lat,geo.lon
50150601,บ้านท่าขี้ควาย (บ้านวังศรี),Ban Tha Khi Khwai (Ban Wang Si),50150601,50150601,18.691214720716044,98.98529827594757
50150602,บ้านน้ำโท้ง,Ban Nam Thong,50150602,50150602,18.684885599763238,98.98396655917168
50150603,บ้านเกาะ,Ban Ko,50150603,50150603,18.70930006773406,98.97505223751068
50150604,บ้านท่าศาลา,Ban Tha Sala,50150604,50150604,18.668756833200572,98.96879866719246
50150605,บ้านหนองคำ,Ban Nong Kham,50150605,50150605,18.664607191450877,98.96651208400726
