id,name.th,name.en,name.slug,code.dopa,geo.lat,geo.lon
20010550,ชุมชนบ้านหนองตะโก,,20010550,20010550,13.346457891118746,101.00355863571167
20010551,ชุมชนบ้านหนองตาท้วม,,20010551,20010551,13.344542313836659,100.99188566207886
20010552,ชุมชนบ้านห้วยทวน,,20010552,20010552,13.338039937875239,100.98046347498894
20010553,ชุมชนเพชรบ้านสวน,,20010553,20010553,13.351813075597818,100.98948374390602
20010554,ชุมชนหมู่ที่5บ้านสวน,,20010554,20010554,13.355573638532647,100.99638774991035
20010555,ชุมชนบ้านหนองแหน,,20010555,20010555,13.351822209582929,101.00684970617294
20010556,ชุมชนบ้านเขามยุรา,,20010556,20010556,13.3725150175142,101.00837051868439
20010557,ชุมชนบ้านเขาน้อย,,20010557,20010557,13.370444381390357,100.99723532795906
20010558,ชุมชนดงตาล,,20010558,20010558,13.374982274003374,100.99532693624496
20010559,ชุมชนบ้านศาลาคู่,,20010559,20010559,13.37019256368579,101.01337552070618
20010560,ชุมชนคลองยี่รัด,,20010560,20010560,13.3525176962917,100.97203597426414
20010561,ชุมชบ้านสวนอุดม,,20010561,20010561,13.344550143202527,100.97907140851021
20010562,ชุมชนบ้านสวนพัฒนา,,20010562,20010562,13.355357035873345,100.9834286570549
20010563,ชุมชนตลาดบ้านสวน,,20010563,20010563,13.362932794078068,100.99217131733894
20010564,ชุมชนเมรี่,,20010564,20010564,13.36171150294926,100.99834576249123
20010565,ชุมชนเมืองทอง,,20010565,20010565,13.357384742315963,101.0030409693718
20010566,ชุมชนหมู่บ้านสัมพันธ์วิลล่า,,20010566,20010566,13.3550986782303,101.00134313106537
20010567,ชุมชนศาลเจ้าพ่อลิง,,20010567,20010567,13.367187692749024,100.99626436829567
20010568,ชุมชนศูนย์ฝึกอบรมตำรวจฯ,,20010568,20010568,13.368530299285473,100.9983578324318
20010569,ชุมชนบ้านพักตำรวจ,,20010569,20010569,13.367678286480487,101.0039073228836
20010570,ชุมชนพยัคฆ์น้อย,,20010570,20010570,13.385541220043873,100.99381819367409
20010571,ชุมชนพันสอง,,20010571,20010571,13.379595754046461,100.99810972809792
20010572,ชุมชนนวมินทร์,,20010572,20010572,13.379544870557229,100.99654868245125
20010573,ชุมชนมรกตใต้,,20010573,20010573,13.375849917690513,100.99858716130257
20010574,ชุมชนบางแสน,,20010574,20010574,13.3736840644569,100.99835246801376
20010575,ชุมชนราชันย์สามัคคี,,20010575,20010575,13.38235779808978,100.99729031324387
20010576,ชุมชนบ้านบ่อบุญทอง,,20010576,20010576,13.376461832938528,100.99147528409958
20010577,ชุมชนโพธิ์ทองสามัคคี,,20010577,20010577,13.37953965173721,100.99466308951378
20010578,ชุมชนสุขนิมิตต์,,20010578,20010578,13.374783955007663,101.00020185112953
20010579,ชุมชนบ้านสวนสามัคคี,,20010579,20010579,13.350342499487322,100.98982974886894
20010580,ชุมชนโชคนำชัย,,20010580,20010580,13.357534797134944,101.00793197751045
20010581,ชุมชนอยู่สบาย,,20010581,20010581,13.354120048286662,101.01131826639175
20010582,ชุมชนเนินยายวาส,,20010582,20010582,13.374466905221531,101.00853279232979
20010583,ชุมชนบ้านสวนยามนิมิตต์,,20010583,20010583,13.349958869463572,101.00211828947067
20010585,ชุมชนบ้านสวนสวัสดี,,20010585,20010585,13.33979767145356,101.01032987236977
20010586,ชุมชนแพรเพชรแก้ว,,20010586,20010586,13.352464197385244,100.98201513290405
20010587,ชุมชนหนองบัวขาว,,20010587,20010587,13.328593368990212,100.98161146044731
20010588,ชุมชนบ้านสวนแก้ว,,20010588,20010588,13.342284836094644,100.98842695355415
20010589,ชุมชนบ้านสวนสุขใจ,,20010589,20010589,13.358623017986288,100.99067732691765
20010590,ชุมชนบ้านหนองกระทุ่ม,,20010590,20010590,13.354219216301624,100.99440425634384
20010591,ชุมชนสงวนวงศ์,,20010591,20010591,13.34766621066305,100.97566768527031
20010592,ชุมชนบ้านสวนพระยาสัจจา,,20010592,20010592,13.354156583875865,100.97507894039154
20010593,ชุมชนแกรนด์ชล เลค แอนด์ การ์เด้น,,20010593,20010593,13.352504647779028,101.01406618952751
