id,name.th,name.en,name.slug,code.dopa,geo.lat,geo.lon
76040801,บ้านสามพระยา,Ban Sam Phraya,76040801,76040801,12.652224044765154,99.91770520806313
76040802,บ้านช้างแทงกระจาด,Ban Chang Thaeng Krachat,76040802,76040802,12.687235532089224,99.86947774887085
76040803,บ้านดอนมะกอก,Ban Don Makok,76040803,76040803,12.667494239863302,99.87484082579613
76040804,บ้านหนองข้าวนก,Ban Nong Khao Nok,76040804,76040804,12.670781072286358,99.88736942410469
76040805,บ้านหนองโสน,Ban Nong Sano,76040805,76040805,12.660431070448524,99.86627653241158
76040806,บ้านอ่างหิน,Ban Ang Hin,76040806,76040806,12.723815938387666,99.9040675163269
76040807,บ้านเขากระปุกพัฒนา,Ban Khao Krabuk Phatthana,76040807,76040807,12.710235450854439,99.9143148958683
76040808,บ้านโครงการพัฒนา,Ban Khrong Kan Phatthana,76040808,76040808,12.674728617139188,99.9184937775135
