id,name.th,name.en,name.slug,code.dopa,geo.lat,geo.lon
94101201,บ้านเขาตูม,Ban Khao Tum,94101201,94101201,6.594205436961569,101.30101159214973
94101202,บ้านบูเกะดาตู,Ban Bu Ke Da Tu,94101202,94101202,6.6059888912823315,101.30627274513245
94101203,บ้านโสร่ง,Ban So Rong,94101203,94101203,6.609051610921271,101.33165180683136
94101204,บ้านบาโงยะหา,Ban Ba Ngo Ya Tha,94101204,94101204,6.607722081193387,101.34513661265373
94101205,บ้านจาเราะบองอ,Ban Cha Ro Bo Ngo,94101205,94101205,6.581956742160804,101.35759145021439
94101206,บ้านโคกขี้เหล็ก,Ban Khok Khilek,94101206,94101206,6.634427890568764,101.3426823914051
94101207,บ้านนิปิกูเละ,Ban Ni Pi Ku Le,94101207,94101207,6.620437727565909,101.31262019276619
