id,name.th,name.en,name.slug,code.dopa,geo.lat,geo.lon
70040401,บ้านคลองกอไผ่,Ban Khlong Ko Phai,70040401,70040401,13.508561178792958,99.93964701890945
70040402,บ้านบางคนที,Ban Bang Khonthi,70040402,70040402,13.51171032497664,99.95725974440575
70040403,บ้านยายแพง,Ban Yai Phaeng,70040403,70040403,13.498307583725772,99.95868667960167
70040404,บ้านคลองตาหลวง,Ban Khlong Ta Luang,70040404,70040404,13.507429301599734,99.96575027704239
70040405,บ้านคลองมะยม,Ban Khlong Mayom,70040405,70040405,13.497642512744791,99.97218757867813
70040406,บ้านวัดปรกเจริญ,Ban Wat Prok Charoen,70040406,70040406,13.497075244855484,99.96124818921089
