id,name.th,name.en,name.slug,code.dopa,geo.lat,geo.lon
19130101,บ้านเขาดิน,Ban Khao Din,19130101,19130101,14.615034417643166,100.90094670653343
19130102,บ้านเขาดิน,Ban Khao Din,19130102,19130102,14.617880278077838,100.90364500880241
19130103,บ้านตั้งใหม่มงคล,Ban Tang Mai Mongkhon,19130103,19130103,14.604443548049577,100.91538771986961
19130104,บ้านตั้งใหม่มงคล,Ban Tang Mai Mongkhon,19130104,19130104,14.612575242710365,100.91724917292595
19130105,บ้านโนนเดื่อ,Ban Non Duea,19130105,19130105,14.628705371068202,100.91952100396156
19130106,บ้านเขาหินปูน,Ban Khao Hin Pun,19130106,19130106,14.633721949782098,100.92749387025833
19130107,บ้านโคกดินแดง,Ban Khok Din Daeng,19130107,19130107,14.642872433741429,100.94595551490784
