id,name.th,name.en,name.slug,code.dopa,geo.lat,geo.lon
30220701,บ้านจิตประสงค์,Ban Chit Prasong,30220701,30220701,14.810447160624252,102.34899088740349
30220702,บ้านอ่างน้ำลุงเขว้า,Ban Ang Nam Lung Khwao,30220702,30220702,14.80307356263722,102.34348967671394
30220703,บ้านขุนจิตพัฒนา,Ban Khun Chit Phatthana,30220703,30220703,14.810906138384256,102.3443104326725
30220704,บ้านหนองพยอม,Ban Nong Phayom,30220704,30220704,14.817183923025988,102.3352338373661
30220705,บ้านร่มเย็น,Ban Rom Yen,30220705,30220705,14.784864745302222,102.36231341958046
30220706,บ้านลุงเขว้า,Ban Lung Khwao,30220706,30220706,14.813792230495512,102.35181525349617
30220707,บ้านตะครองงาม,Ban Ta Krong Ngam,30220707,30220707,14.817989053246526,102.34089598059654
30220708,บ้านหนองจาน,Ban Nong Chan,30220708,30220708,14.788494182891775,102.38017693161964
30220709,บ้านจงประเสริฐ,Ban Chong Prasoet,30220709,30220709,14.807444332989842,102.34628856182098
