id,name.th,name.en,name.slug,code.dopa,geo.lat,geo.lon
74011201,บ้านบางน้ำจืด,Ban Bang Nam Chuet,74011201,74011201,13.59743584860591,100.36119908094406
74011202,บ้านริมทางรถไฟ,Ban Rim Thang Rot Fai,74011202,74011202,13.614096796137778,100.34694984555244
74011203,บ้านโพธิ์แจ้,Ban Pho Chae,74011203,74011203,13.621965433841666,100.3521466255188
74011204,บ้านทุ่งศรีเมือง,Ban Thung Si Mueang,74011204,74011204,13.61143649350733,100.36493808031082
74011205,บ้านดอนพญา,Ban Don Phaya,74011205,74011205,13.625651364561243,100.33546730875969
74011206,บ้านหนองหาดใหญ่,Ban Nong Hat Yai,74011206,74011206,13.625029661039951,100.32648995518684
