id,name.th,name.en,name.slug,code.dopa,geo.lat,geo.lon
70030201,บ้านห้วยทรายทอง,Ban Huai Sai Thong,70030201,70030201,13.558796504304494,99.44111421704292
70030202,บ้านกล้วย,Ban Kluai,70030202,70030202,13.575213780018656,99.38364654779434
70030203,บ้านทุ่งแหลม,Ban Thung Laem,70030203,70030203,13.616956490345624,99.40614357590675
70030204,บ้านทุ่งศาลา,Ban Thung Sala,70030204,70030204,13.618366773483514,99.38448071479797
70030205,บ้านหนองหม้อข้าว,Ban Nong Mo Khao,70030205,70030205,13.581237812785075,99.43376496434212
70030206,บ้านโป่งยอ,Ban Pong Yo,70030206,70030206,13.558251545491808,99.36843171715736
70030207,บ้านห้วยลาดปลาเค้า,Ban Huai Lat Pla Khao,70030207,70030207,13.61754562998046,99.38725546002388
70030208,บ้านหนองต้นไทร,Ban Npng Ton Sai,70030208,70030208,13.588957632817413,99.39294710755348
70030209,บ้านหนองขาม,Ban Nong Kham,70030209,70030209,13.572602579583656,99.45583283901215
