id,name.th,name.en,name.slug,code.dopa,geo.lat,geo.lon
86080101,บ้านปากน้ำตะโก,Ban Pak Nam Tako,86080101,86080101,10.096723952555761,99.14178773760796
86080102,บ้านหนองไม้แก่น,Ban Nong Mai Kaen,86080102,86080102,10.116902000715468,99.1367357969284
86080103,บ้านอ่าวมะม่วง,Ban Ao Mamuang,86080103,86080103,10.145303329387296,99.15096893906593
86080104,บ้านเกาะแก้ว,Ban Ko Kaeo,86080104,86080104,10.069695558972066,99.1459196805954
86080105,บ้านรัตนโกสัย,Ban Rattana Kosai,86080105,86080105,10.164011739671285,99.16409566998482
