id,name.th,name.en,name.slug,code.dopa,geo.lat,geo.lon
80041601,บ้านท่าสะท้อน,Ban Tha Sathon,80041601,80041601,8.411107095294671,99.57893282175064
80041602,บ้านปากมิน,Ban Pak Min,80041602,80041602,8.381463960926416,99.52948227524757
80041603,บ้านตลาดจันดี,Ban Talat Chan Di,80041603,80041603,8.388193335390323,99.5481450855732
80041604,บ้านตลาดจันดี,Ban Talat Chan Di,80041604,80041604,8.38496266640819,99.543247371912
80041605,บ้านเกาะค่างคาว,Ban Ko Khan Khao,80041605,80041605,8.392047548051073,99.53499555587769
