id,name.th,name.en,name.slug,code.dopa,geo.lat,geo.lon
54040701,บ้านปงท่าข้าม,Ban Pong Tha Kham,54040701,54040701,18.064366341249123,100.07692247629166
54040702,บ้านปงท่าข้าม,Ban Pong Tha Kham,54040702,54040702,18.061927249680025,100.07564038038254
54040703,บ้านปงหัวหาด,Ban Pong Hua Hat,54040703,54040703,18.04915238491316,100.0694189965725
54040704,บ้านหาดเจริญ,Ban Hat Charoen,54040704,54040704,18.045367817144328,100.06589189171791
54040705,บ้านปงท่าข้าม,Ban Pong Tha Kham,54040705,54040705,18.057018363687764,100.07366091012955
54040706,บ้านปงหาดเจริญ,Ban Pong Hat Charoen,54040706,54040706,18.041775,100.068880
