id,name.th,name.en,name.slug,code.dopa,geo.lat,geo.lon
30220801,บ้านหนองไม้ไผ่,Ban Nong Mai Phai,30220801,30220801,14.657604273899022,102.31703102588654
30220802,บ้านสระมะค่า,Ban Sa Makha,30220802,30220802,14.643375880939773,102.31004655361176
30220803,บ้านหนองตะลุมปุ๊ก,Ban Nong Ta Lumpuk,30220803,30220803,14.644474896967804,102.28485256433487
30220804,บ้านด่านตลอด,Ban Dan Talot,30220804,30220804,14.68026321583552,102.3191325366497
30220805,บ้านด่านกอโจด,Ban Dan Ko Chot,30220805,30220805,14.644333465461928,102.27170571684837
30220806,บ้านเจริญสุข,Ban Charoen Suk,30220806,30220806,14.64624213433081,102.31532648205757
30220807,บ้านหัวอ่างพัฒนา,Ban Hua Ang Phatthana,30220807,30220807,14.66583389920043,102.31805697083473
30220808,บ้านสุขสวัสดิ์,Ban Suk Sawat,30220808,30220808,14.657286396310635,102.32092157006264
30220809,บ้านหนองไม้ไผ่แสนสุข,Ban Nong Mai Phai Saen Suk,30220809,30220809,14.65290353094986,102.31555715203285
