id,name.th,name.en,name.slug,code.dopa,geo.lat,geo.lon
16041901,บ้านใหม่สามัคคี,Ban Mai Samakkhi,16041901,16041901,15.233600406191734,101.09185829758644
16041902,บ้านโป่งสามหัว,Ban Pong Sam Hua,16041902,16041902,15.251742538871595,101.060335636139
16041903,บ้านซับม่วง,Ban Sap Muang,16041903,16041903,15.27557912169118,101.06592535972597
16041904,บ้านซับหินขวาง,Ban Sap Hin Khwang,16041904,16041904,15.262069554567288,101.02335602045059
16041905,บ้านหนองสองตอน,Ban Nong Song Ton,16041905,16041905,15.240486863243932,101.07381910085678
16041906,บ้านโศกดินแดง,Ban Sok Din Daeng,16041906,16041906,15.247464961449026,101.0887898504734
