id,name.th,name.en,name.slug,code.dopa,geo.lat,geo.lon
65060501,บ้านหอกลอง,Ban Ho Klong,65060501,65060501,16.976228624480736,100.25205329060555
65060502,บ้านกระบัง,Ban Krabang,65060502,65060502,16.955037766834682,100.23467123508453
65060503,บ้านปากคลอง,Ban Pak Khlong,65060503,65060503,16.963015404816726,100.23178786039352
65060504,บ้านบางยี่ทุ่ม,Ban Bang Yi Thum,65060504,65060504,16.974219956918212,100.23405835032463
65060505,บ้านโปร่งนก,Ban Prong Nok,65060505,65060505,16.98807368206934,100.23151159286499
65060506,บ้านใหม่หอกลอง,Ban Mai Ho Klong,65060506,65060506,16.857571437783935,100.28601408004761
65060507,บ้านใหม่โปร่งนก,Ban Mai Prong Nok,65060507,65060507,16.988535412535875,100.22925183176994
