id,name.th,name.en,name.slug,code.dopa,geo.lat,geo.lon
45180301,บ้านปากบุ่ง,Ban Pak Bung,45180301,45180301,16.195451282450456,103.77472043037415
45180302,บ้านดอนยาง,Ban Don Yang,45180302,45180302,16.205325241073943,103.77218574285507
45180303,บ้านบุ่งค้า,Ban Bung Kha,45180303,45180303,16.195697268120192,103.74668195843697
45180304,บ้านดอนวิเวก,Ban Don Wiwek,45180304,45180304,16.165146336313573,103.77531319856644
45180305,บ้านโนนก้านเหลือง,Ban Non Kan Lueang,45180305,45180305,16.15560786230033,103.77392247319221
45180306,บ้านดอนสำราญเหนือ,Ban Don Samran Nuea,45180306,45180306,13.72706875088845,100.5340875685215
45180307,บ้านดอนสำราญใต้,Ban Don Samran Tai,45180307,45180307,13.72706875088845,100.5340875685215
45180308,บ้านแก้งข่า,Ban Kaeo Kha,45180308,45180308,16.19241056515192,103.76434564590454
