id,name.th,name.en,name.slug,code.dopa,geo.lat,geo.lon
73031101,บ้านคันบึง (ท่าข้าม),Ban Khan Bueng (Tha Kham),73031101,73031101,13.732579524644903,100.13399451971054
73031102,บ้านโคกพระ,Ban Khok Phra,73031102,73031102,13.73835071622416,100.12050434947014
73031103,บ้านวงพาด,Ban Wong Phat,73031103,73031103,13.735638404154344,100.11460214853287
73031104,บ้านดอนมะขามเทศ,Ban Don Makham Thet,73031104,73031104,13.724048844061798,100.10952338576317
73031105,บ้านปากรางโพรงเข้,Ban Pak Rang Phrong Khe,73031105,73031105,13.730280127698965,100.13998657464981
