id,name.th,name.en,name.slug,code.dopa,geo.lat,geo.lon
72050101,บ้านวัดถั่ว,Ban Wat Thua,72050101,72050101,14.586118231331847,100.1478910446167
72050102,บ้านทำเน,Ban Tham Ne,72050102,72050102,14.613429,100.152402
72050103,บ้านหลังตลาด,Ban Lang Talat,72050103,72050103,14.618204,100.144090
72050104,บ้านสะพานหลวง,Ban Saphan Luang,72050104,72050104,14.631095591782298,100.17514765262604
72050105,บ้านลาดปลาเค้า,Ban Lat Pla Khao,72050105,72050105,14.59833095270136,100.17615482211113
72050106,บ้านม่วงเจริญผล,Ban Muang Charoen Phon,72050106,72050106,14.588621829538992,100.2080100774765
