id,name.th,name.en,name.slug,code.dopa,geo.lat,geo.lon
13010801,บ้านทำนบบางหลวง,Ban Thamnop Bang Luang,13010801,13010801,14.016660992237268,100.50441697239876
13010802,บ้านคลองบางหลวง,Ban Khlong Bang Luang,13010802,13010802,14.002698975287045,100.51589280366898
13010803,บ้านโรงเต้าหู้,Ban Rong Tao Hu,13010803,13010803,13.991346566458517,100.52712857723236
13010804,บ้านคลองบางโพธิ์,Ban Khlong Bang Pho,13010804,13010804,13.994481417640317,100.51675245165825
13010805,บ้านคลองบางโพธิ์,Ban Khlong Bang Pho,13010805,13010805,14.003215572023162,100.50223231315613
13010806,บ้านทำนบบางโพธิ์,Ban Thamnop Bang Pho,13010806,13010806,14.011993635181131,100.47004580497742
13010807,บ้านปลายคลองบางโพธิ,Ban Plai Khlong Bang Pho,13010807,13010807,14.014590815747432,100.45337051153183
