id,name.th,name.en,name.slug,code.dopa,geo.lat,geo.lon
57060601,บ้านศรีโพธิ์เงิน,Ban Si Pho Ngoen,57060601,57060601,19.44755874078907,99.96521785855293
57060602,บ้านศรีมงคล,Ban Si Mongkhon,57060602,57060602,19.44636749267143,99.9673555791378
57060603,บ้านป่าไม้สีเหลือง,Ban Pa Mai Si Lueang,57060603,57060603,19.44347912228999,99.96868461370468
57060604,บ้านร่องบง,Ban Rong Bong,57060604,57060604,19.44095618228563,99.9693551659584
57060605,บ้านศรีพัฒนา,Ban Si Phatthana,57060605,57060605,19.439877439579394,99.96719866991043
57060606,บ้านศรีโพธิ์ทอง,Ban Si Pho Thong,57060606,57060606,19.442461098586442,99.96511459350586
57060607,บ้านร่องบงใต้,Ban Rong Bong Tai,57060607,57060607,19.430595909323763,99.9765394628048
57060608,บ้านดอนศิลา,Ban Don Sila,57060608,57060608,19.434965465401625,99.96764793992043
