id,name.th,name.en,name.slug,code.dopa,geo.lat,geo.lon
63050501,บ้านซอแขระกา,Ban Sokhae Raka,63050501,63050501,17.56571503288063,97.92448058724403
63050502,บ้านปางทอง,Ban Pang Thong,63050502,63050502,17.73207113097449,97.95217573642731
63050503,บ้านแม่วะหลวง,Ban Mae Wa Luang,63050503,63050503,17.806205715014258,97.94870629906654
63050504,บ้านแม่อมกิ,Ban Mae Om Ki,63050504,63050504,17.754238865567313,97.96348661184311
63050505,บ้านบอหมาก,Ban Bo Mak,63050505,63050505,17.671019377225697,97.94824227690697
63050506,บ้านแม่หละยอคี,Ban Mae La Yo Khi,63050506,63050506,17.644903857001864,97.99607411026955
63050507,บ้านอมกอทะ,Ban Om Ko Tha,63050507,63050507,17.616923488012052,98.04752424359322
63050508,บ้านวะหย่าโจ,Ban Wa Ya Cho,63050508,63050508,17.58243540819723,98.06669935584068
63050509,บ้านเกร้คี,Ban Ke Khi,63050509,63050509,17.588908097606815,98.08138981461525
