id,name.th,name.en,name.slug,code.dopa,geo.lat,geo.lon
57090801,บ้านด้าย,Ban Dai,57090801,57090801,20.28622523671518,99.94842857122421
57090802,บ้านกิ่วพร้าว,Ban Kio Phrao,57090802,57090802,20.29825676394492,99.95052471756935
57090803,บ้านดงป่าสัก,Ban Dong Pa Sak,57090803,57090803,20.287769953428242,99.94076684117317
57090804,บ้านสันทรายน้อย,Ban San Sai Noi,57090804,57090804,20.306669,99.930602
57090805,บ้านสันปูเลย,Ban San Pu Loei,57090805,57090805,20.321357443260542,99.94484648108482
57090806,บ้านป่าบงงาม,Ban Pa Bong Ngam,57090806,57090806,20.29899007198818,99.91273239254951
57090807,บ้านสันสลี,Ban San Sali,57090807,57090807,20.340843247615528,99.93341088294983
57090808,บ้านป่าก๋อย,Ban Pa Koi,57090808,57090808,20.32752852802474,99.99873876571655
