id,name.th,name.en,name.slug,code.dopa,geo.lat,geo.lon
15050601,บ้านแสวงสุข,Ban Sawaeng Suk,15050601,15050601,14.756116264139719,100.35106837749481
15050602,บ้านห้วยไผ่ใต้,Ban Huai Phai Tai,15050602,15050602,14.780510377479658,100.34122332930565
15050603,บ้านห้วยไผ่เหนือ,Ban Huai Phai Nuea,15050603,15050603,14.78654267075888,100.33584952354431
15050604,บ้านสำโรงปม,Ban Samrong Pom,15050604,15050604,14.791320926823328,100.31490951776505
15050605,บ้านวัดยาง,Ban Wat Yang,15050605,15050605,14.800743572811086,100.32760709524155
