id,name.th,name.en,name.slug,code.dopa,geo.lat,geo.lon
90070301,บ้านปากบางตะเครียะ,Ban Pak Bang Takhria,90070301,90070301,7.810743531758969,100.26420906186104
90070302,บ้านหนองถ้วย,Ban Nong Thuai,90070302,90070302,7.8678601352149276,100.24632811546326
90070303,บ้านหนองลาน,Ban Nong Lan,90070303,90070303,7.823482550970336,100.25708511471748
90070304,บ้านคลองโพธิ์,Ban Khlong Pho,90070304,90070304,7.799330167235786,100.2645081281662
90070305,บ้านดอนแบกปากเหมือง,Ban Don Baek Pak Mueang,90070305,90070305,7.843319729128385,100.25274395942688
