id,name.th,name.en,name.slug,code.dopa,geo.lat,geo.lon
73060101,บ้านคลองลัด,Ban Khlong Lat,73060101,73060101,13.71481951776435,100.23408114910126
73060102,บ้านคลองลัดท่านา,Ban Khlong Lat Tha Na,73060102,73060102,13.717278014367189,100.2358728647232
73060103,บ้านท่าข้าม,Ban Tha Kham,73060103,73060103,13.717569853271748,100.23424878716469
73060104,บ้านโรงหีบ,Ban Rong Hip,73060104,73060104,13.719689582996947,100.24568036198616
73060105,บ้านคลองตัน,Ban Khlong Tan,73060105,73060105,13.704591791392867,100.24049833416939
73060106,บ้านโรงหีบพัฒนา,Ban Rong Hip Phatthana,73060106,73060106,13.714156357673865,100.26288270950317
