id,name.th,name.en,name.slug,code.dopa,geo.lat,geo.lon
72060401,บ้านหนองไผ่ล้อม,Ban Nong Phai Lom,72060401,72060401,14.63430067859326,99.87929999828339
72060402,บ้านหัวนา-หินแลง,Ban Hua Na - Hin Laeng,72060402,72060402,14.626034833102176,99.9014000594616
72060403,บ้านสระกระโจม,Ban Sa Krachom,72060403,72060403,14.62274268207206,99.85830500721931
72060404,บ้านดอนโพธิ์,Ban Don Pho,72060404,72060404,14.659041853313985,99.88146856427193
72060405,บ้านหนองสลัดได,Ban Nong Salat Tai,72060405,72060405,14.655040480697403,99.84242096543312
72060406,บ้านดอนกลาง,Ban Don Klang,72060406,72060406,14.667807250683174,99.81344640254974
72060407,บ้านหนองเสาธง,Ban Nong Sao Thong,72060407,72060407,14.666797872594168,99.84426230192184
72060408,บ้านห้วยวันดี (ดอนกระเพรา),Ban Huai Wan Di (Don Kraphrao),72060408,72060408,14.639327509924378,99.82999294996262
72060409,บ้านดอนกลางพัฒนา,Ban Don Klang Phatthana,72060409,72060409,14.684500235937781,99.81157422065735
