id,name.th,name.en,name.slug,code.dopa,geo.lat,geo.lon
64020201,บ้านหนองจัง,Ban Nong Chang,64020201,64020201,17.018987872957453,99.56856206059456
64020202,บ้านด่าน,Ban Dan,64020202,64020202,17.017829885106767,99.5950099825859
64020203,บ้านด่าน,Ban Dan,64020203,64020203,17.022175829077945,99.59452852606773
64020204,บ้านบ่อไม้แดง,Ban Bo Mai Daeng,64020204,64020204,17.031695773807233,99.59260001778603
64020205,บ้านวังแดด,Ban Wang Daet,64020205,64020205,17.046287636326344,99.59386602044106
64020206,บ้านวังส้มป่อย,Ban Wang Som Poi,64020206,64020206,17.047536482712818,99.61958035826683
64020207,บ้านหนองน้ำขุ่น,Ban Nong Nam Khun,64020207,64020207,17.036919740176945,99.55508127808571
64020208,บ้านนาตาปาด,Ban Na Ta Pat,64020208,64020208,17.075856384126485,99.56142336130142
