id,name.th,name.en,name.slug,code.dopa,geo.lat,geo.lon
57041301,บ้านหนองแรด,Ban Nong Raet,57041301,57041301,19.62230525453051,100.11610820889473
57041302,บ้านหนองแรดเหนือ,Ban Nong Raet Nuea,57041302,57041302,19.623533101880305,100.10951533913612
57041303,บ้านหนองแรดใต้,Ban Nong Raet Tai,57041303,57041303,19.61866586998262,100.12801319360733
57041304,บ้านหนองแรดกลาง,Ban Nong Raet Klang,57041304,57041304,19.61813783025235,100.122911632061
57041305,บ้านม่อนป่ายางเหนือ,Ban Mon Pa Yang Nuea,57041305,57041305,19.6204824144663,100.11077731847763
57041306,บ้านม่อนป่ายางใต้,Ban Mon Pa Yang Tai,57041306,57041306,19.61607113175748,100.10953545570374
57041307,บ้านหนองแรดป่าตาล,Ban Nong Raet Pa Tan,57041307,57041307,19.616764666182704,100.12485757470131
