id,name.th,name.en,name.slug,code.dopa,geo.lat,geo.lon
20100301,บ้านหนองเสม็ด,Ban Nong Samet,20100301,20100301,13.326314862402901,101.27074956893921
20100302,บ้านหนองยายเภา,Ban Nong Yai Phao,20100302,20100302,13.279476753966875,101.43953561782837
20100303,บ้านโปร่งไม้ไร่,Ban Prong Mai Rai,20100303,20100303,13.279476753966875,101.43953561782837
20100304,บ้านบ่อกวางทอง,Ban Bo Kwang Thong,20100304,20100304,13.282728097489205,101.31952553987503
20100305,บ้านหนองเกตุ,Ban Nong Ket,20100305,20100305,13.318907610230244,101.30535140633583
20100306,บ้านเนินสูง,Ban Noen Sung,20100306,20100306,13.313935384612517,101.32297351956367
20100307,บ้านหนองบอน,Ban Nong Bon,20100307,20100307,13.307316032378019,101.33406445384026
20100308,บ้านสำเภาทอง,Ban Samphao Thong,20100308,20100308,13.339385316394551,101.28725051879883
