id,name.th,name.en,name.slug,code.dopa,geo.lat,geo.lon
70071601,บ้านเขาเดิน,Ban Khao Din,70071601,70071601,13.694036571539538,99.78266268968582
70071602,บ้านหนองพง,Ban Nong Phong,70071602,70071602,13.682571353882638,99.76574465632439
70071603,บ้านนางแก้วตะวันออก,Ban Nang Kaeo Tawan Ok,70071603,70071603,13.68246320108451,99.76591095328331
70071604,บ้านนางแก้วตะวันตก,Ban Nang Kaeo Tawan Tok,70071604,70071604,13.692144634128908,99.76341649889946
70071605,บ้านเขาค่าง,Ban Khao Khang,70071605,70071605,13.70670251789202,99.76246431469917
70071606,บ้านเขาขวาง,Ban Khao Khwang,70071606,70071606,13.712284125463123,99.76826593279839
70071607,บ้านขุยจาม,Ban Khui Cham,70071607,70071607,13.710290709415268,99.7744832932949
70071608,บ้านไผ่เจริญ,Ban Phai Charoen,70071608,70071608,13.692353112826696,99.75825056433678
70071609,บ้านห้วยตาบุญจันทร์,Ban Huai Tabun Chan,70071609,70071609,13.705529894400302,99.74616721272469
