id,name.th,name.en,name.slug,code.dopa,geo.lat,geo.lon
53080601,บ้านไผ่ล้อม,Ban Phai Lom,53080601,53080601,17.59299256111269,100.06762459874153
53080602,บ้านไผ่เขียว,Ban Phai Khiao,53080602,53080602,17.576365213590446,100.06811141967773
53080603,บ้านเกาะตาเพ็ชร,Ban Ko Ta Phet,53080603,53080603,17.58138451714401,100.07328808307648
53080604,บ้านดงสระแก้ว,Ban Dong Sa Kaeo,53080604,53080604,17.51699110140396,100.04059597849846
53080605,บ้านดงสระแก้วใต้,Ban Dong Sa Kaeo Tai,53080605,53080605,17.512155461458384,100.03547564148903
53080606,บ้านท้ายเตย,Ban Huai Toei,53080606,53080606,17.57480032836975,100.0703376531601
53080607,บ้านทุ่งสวรรค์,Ban Thung Sawan,53080607,53080607,17.4952239519242,100.03337949514389
