id,name.th,name.en,name.slug,code.dopa,geo.lat,geo.lon
12040501,บ้านคลองลากค้อนเหนือ,Ban Khlong Lak Khon Nuea,12040501,12040501,13.933667578531084,100.431067943573
12040502,บ้านสุเหร่าลำรี,Ban Su Rao Lam Ri,12040502,12040502,13.928926947118539,100.43010637164116
12040503,บ้านละหาร,Ban Lahan,12040503,12040503,13.937503642239765,100.44101737441277
12040504,บ้านเกาะดอน,Ban Ko Don,12040504,12040504,13.93579575456086,100.43502151966095
12040505,บ้านคลองลากค้อน,Ban Khlong Lak Khon,12040505,12040505,13.965042844705819,100.4047742486
12040506,บ้านลากค้อน,Ban Lak Khon,12040506,12040506,13.968205384596335,100.40563255548477
12040507,บ้านสุเหร่าแดง,Ban Surao Daeng,12040507,12040507,13.959230410988877,100.43910917595122
12040508,บ้านลำรี,Ban Lam Ri,12040508,12040508,13.961154771022661,100.3907615588143
12040509,บ้านคลองลำรี,Ban Khlong Lam Ri,12040509,12040509,13.945228479651178,100.40524497628212
