id,name.th,name.en,name.slug,code.dopa,geo.lat,geo.lon
94101001,บ้านต้นไพ,Ban Ton Phai,94101001,94101001,6.698800552924525,101.29464637488127
94101002,บ้านดูซงปาแย,Ban Du Saeng Pa Yae,94101002,94101002,6.683303081384413,101.28580648452044
94101003,บ้านเมาะมาวี,Ban Mo Mawi,94101003,94101003,6.688874768717858,101.29669558256865
94101004,บ้านต้นมะขาม,Ban Ton Makham,94101004,94101004,6.667685,101.304118
94101005,บ้านเกาะบาตอ,Ban Ko Bato,94101005,94101005,6.641270,101.314146
94101006,บ้านดารุสสลาม,Ban Da Ru Sasalan,94101006,94101006,6.690168781679574,101.29670765250921
