id,name.th,name.en,name.slug,code.dopa,geo.lat,geo.lon
16060801,บ้านบางพึ่งเจริญ 1,Ban Bang Phueng Charoen 1,16060801,16060801,15.029496653261782,100.49893990159035
16060802,บ้านบางพึ่งเจริญ 2,Ban Bang Phueng Charoen 2,16060802,16060802,15.01456473556435,100.49239531159401
16060803,บ้านบางโพธิ์,Ban Bang Pho,16060803,16060803,15.002155217254982,100.48909619450569
16060804,บ้านบางไผ่,Ban Bang Phai,16060804,16060804,14.998517718777022,100.48625841736794
16060805,บ้านแหลมเทพนม,Ban Laem Thep Nom,16060805,16060805,14.989914685066035,100.47939866781235
16060806,บ้านแหลมฟ้าผ่า,Ban Laem Fa Pha,16060806,16060806,14.980401848047062,100.47548666596413
16060807,บ้านหัวลาด,Ban Hua Lat,16060807,16060807,14.963148631758745,100.47444462776184
16060808,บ้านคุ้งเจริญ,Ban Khung Charoen,16060808,16060808,14.958965000183953,100.47864899039268
16060809,บ้านพระวรสาร,Ban Phra Warasan,16060809,16060809,14.970695546330058,100.47559529542923
