id,name.th,name.en,name.slug,code.dopa,geo.lat,geo.lon
50190301,บ้านหนองป่าแสะ,Ban Nong Pa Sae,50190301,50190301,18.718571282012487,99.0505899488926
50190302,บ้านพญาชมภู,Ban Phaya Chom Phu,50190302,50190302,18.71261662707056,99.05994549393654
50190303,บ้านสุพรรณ,Ban Suphan,50190303,50190303,18.728630717550725,99.06350746750832
50190304,บ้านท่าต้นกวาว,Ban Tha Ton Khwao,50190304,50190304,18.720258057417837,99.07076016068459
50190305,บ้านทุ่งขี้เสื้อ,Ban Thung Khi Suea,50190305,50190305,18.70825211800377,99.07509461045265
50190306,บ้านบุปผาราม,Ban Bup Pharam,50190306,50190306,18.693796100780688,99.07092645764351
50190307,บ้านแม่สะลาบ,Ban Mae Salap,50190307,50190307,18.68328104999439,99.06184315681458
50190308,บ้านศรีดอนมูล,Ban Si Don Mun,50190308,50190308,18.703591521128562,99.06005278229713
50190309,บ้านร่มป่าตอง,Ban Rom Pa Tong,50190309,50190309,18.669652563119758,99.0712134540081
