id,name.th,name.en,name.slug,code.dopa,geo.lat,geo.lon
42110401,บ้านห้วยสีเสียด,Ban Huai Sisiat,42110401,42110401,17.14178998968636,101.73605650663376
42110402,บ้านทรัพย์เจริญ,Ban Sap Charoen,42110402,42110402,17.158092903259835,101.76290273666382
42110403,บ้านน้ำพุพัฒนา,Ban Nam Phu Phatthana,42110403,42110403,17.10199677669094,101.75151407718658
42110404,บ้านวังเดือนห้า,Ban Wang Duean Ha,42110404,42110404,17.100788031052254,101.725292801857
42110405,บ้านนามูลตุ่น,Ban Na Mun Tun,42110405,42110405,17.175439926831658,101.72781810164452
42110406,บ้านนาเจริญ,Ban Na Charoen,42110406,42110406,17.17855345480623,101.72724545001984
42110407,บ้านใหม่ศรีชมภู,Ban Mai Si Chomphu,42110407,42110407,17.177168389766035,101.72992765903473
42110408,บ้านนาหนองทุ่ม,Ban Na Nong Thum,42110408,42110408,17.181370960348406,101.72781005501747
