id,name.th,name.en,name.slug,code.dopa,geo.lat,geo.lon
20050401,บ้านหนองกะขะ,Ban Nong Kakha,20050401,20050401,13.72706875088845,100.5340875685215
20050402,บ้านหนองกระทุ่ม,Ban Nong Krathum,20050402,20050402,13.555912641082527,100.47984257340431
20050403,บ้านหนองกะขะล่าง,Ban Nong Kakha Lang,20050403,20050403,13.425279566334785,101.09415963292122
20050404,บ้านกระโดน,Ban Kradon,20050404,20050404,13.4248477907257,101.10131040215492
20050405,บ้านปุนเถ้าม้า,Ban Pun Thao Ma,20050405,20050405,13.72706875088845,100.5340875685215
