id,name.th,name.en,name.slug,code.dopa,geo.lat,geo.lon
24040801,บ้านคลองใหม่,Ban Khlong Mai,24040801,24040801,13.567739908103093,100.99928990006447
24040802,บ้านคลองจางวาง,Ban Khlong Chang Wang,24040802,24040802,13.573542510758477,101.00338026881218
24040803,บ้านบางควาย,Ban Bang Khwai,24040803,24040803,13.593353203224298,100.98463967442513
24040804,บ้านหนองจอก,Ban Nong Chok,24040804,24040804,13.601231655007352,100.98814129829407
24040805,บ้านปลายไม้,Ban Plai Mai,24040805,24040805,13.617549540194384,101.0021598637104
24040806,บ้านคลองขุนพิทักษ์,Ban Khlong Khun Phithak,24040806,24040806,13.624140765534067,100.98799243569374
24040807,บ้านปลายคลองขุนพิทักษ์,Ban Plai Khlong Khun Phithak,24040807,24040807,13.614994853329534,100.98202854394913
24040808,บ้านคลองแขวงกลั่น,Ban Khlong Khwaeng Klan,24040808,24040808,13.61820775861504,100.96933230757713
24040809,บ้านคลองขวาง,Ban Khlong Khwang,24040809,24040809,13.618147802161468,100.9695602953434
