id,name.th,name.en,name.slug,code.dopa,geo.lat,geo.lon
61030301,บ้านเขาผาลาด,Ban Khao Pha Lat,61030301,61030301,15.565382687725025,99.78044986724854
61030302,บ้านหนองแขวบกูบ,Ban Nong Khaeop Kup,61030302,61030302,15.539205445636295,99.80291336774826
61030303,บ้านหนองกี่,Ban Nong Ki,61030303,61030303,15.55481064028011,99.792510420084
61030304,บ้านวังหิน,Ban Wang Hin,61030304,61030304,15.544040365756418,99.75234970450401
61030305,บ้านหนองชุมเห็ด,Ban Nong Chum Het,61030305,61030305,13.72706875088845,100.5340875685215
61030306,บ้านหนองสมบูรณ์,Ban Nong Sombun,61030306,61030306,13.72706875088845,100.5340875685215
61030307,บ้านหนองน้ำใส,Ban Nong Nam Sai,61030307,61030307,15.54917362947967,99.80233266949654
61030308,บ้านโพธิ์ทอง,Ban Pho Thong,61030308,61030308,13.78309281665546,100.45580998063087
