id,name.th,name.en,name.slug,code.dopa,geo.lat,geo.lon
50050401,บ้านป่าตึงน้อย,Ban Pa Tueng Noi,50050401,50050401,18.853512067567504,99.14454102516174
50050402,บ้านป่าไม้แดง,Ban Pa Mai Daeng,50050402,50050402,18.836721624100218,99.15163949131966
50050403,บ้านป่าป้อง,Ban Pa Pong,50050403,50050403,18.83982371169249,99.13016572594643
50050404,บ้านป่าป้อง,Ban Pa Pong,50050404,50050404,18.834222396471652,99.13063377141953
50050405,บ้านป่าป้องใต้ร้อง,Ban Pa Pong Tai Rong,50050405,50050405,18.82493850011446,99.14110913872719
50050406,บ้านดวงดี,Ban Duang Di,50050406,50050406,18.843956354743643,99.1340146958828
50050407,บ้านป่ายางงาม,Ban Pa Yang Ngam,50050407,50050407,18.844759771388958,99.14759337902069
50050408,บ้านทุ่งยาว,Ban Thung Yao,50050408,50050408,18.865880760972686,99.17140334844589
