id,name.th,name.en,name.slug,code.dopa,geo.lat,geo.lon
46020501,บ้านโนนยิ่งสันต์,Ban Non Ying San,46020501,46020501,16.56984777728682,103.83590698242188
46020502,บ้านหนองบัวกลาง,Ban Nong Bua Klang,46020502,46020502,16.559181131707756,103.85913491249084
46020503,บ้านหนองบัวนอก,Ban Nong Bua Nok,46020503,46020503,16.313305008980837,103.74100908637047
46020504,บ้านหนองบัวใน,Ban Nong Bua Nai,46020504,46020504,16.552812741950635,103.87097284197807
46020505,บ้านโนนหนองเบ็ญ,Ban Non Nong Ben,46020505,46020505,16.559972987827134,103.86733174324036
46020506,บ้านหนองบัวศรีวิลัย,Ban Nong Bua Si Wilai,46020506,46020506,16.55401341933698,103.86847034096718
46020507,บ้านหนองบัวทอง,Ban Nong Bua Thong,46020507,46020507,16.566553237702504,103.85666459798813
46020508,บ้านโนนสมบูรณ์,Ban Non Sombun,46020508,46020508,16.565126400495192,103.83231416344643
