id,name.th,name.en,name.slug,code.dopa,geo.lat,geo.lon
61060501,บ้านเขาวงษ์พรหมจรรย์,Ban Khao Wong Phrom Chan,61060501,61060501,15.295849811272582,99.75314497947693
61060502,บ้านวงพง,Ban Wong Phong,61060502,61060502,15.289264000704117,99.72284138202667
61060503,บ้านวังหิน,Ban Wang Hin,61060503,61060503,15.264431137768772,99.68225553631783
61060504,บ้านวังหินใหม่,Ban Wang Hin Mai,61060504,61060504,15.246081781823106,99.68000248074532
61060505,บ้านบุ่งโก,Ban Bung Ko,61060505,61060505,15.280018161824394,99.70531851053238
61060506,บ้านหนองยาว,Ban Nong Yao,61060506,61060506,15.26565376740266,99.70693454146385
