id,name.th,name.en,name.slug,code.dopa,geo.lat,geo.lon
35041201,บ้านแคนน้อย,Ban Khaen Noi,35041201,35041201,15.591924748565996,104.35136988759041
35041202,บ้านแคนน้อย,Ban Khaen Noi,35041202,35041202,15.592069424792426,104.35065776109695
35041203,บ้านหนองเลิง,Ban Nong Loeng,35041203,35041203,15.597724635258363,104.34173807501793
35041204,บ้านดอนเดือยไก่,Ban Don Duai Kai,35041204,35041204,15.608679386062535,104.35245081782341
35041205,บ้านดอนมะยาง,Ban Don Mayang,35041205,35041205,15.621647111968176,104.36214700341225
35041206,บ้านโนนเมืองน้อย,Ban Non Mueang Noi,35041206,35041206,15.574934917348957,104.32616785168648
35041207,บ้านดอนมะฮวน,Ban Don Ma Huan,35041207,35041207,15.621964836787933,104.35570299625397
