id,name.th,name.en,name.slug,code.dopa,geo.lat,geo.lon
54011501,บ้านทุ่งกวาว,Ban Thung Kwao,54011501,54011501,18.157626896588866,100.1593641936779
54011502,บ้านนาแหลมใต้,Ban Na Laem Tai,54011502,54011502,18.151064019000543,100.16340494155884
54011503,บ้านนาแหลมเหนือ,Ban Na Laem Nuea,54011503,54011503,18.149815132827214,100.16785204410553
54011504,บ้านหัวดง,Ban Hua Dong,54011504,54011504,18.155283404129598,100.1490966975689
54011505,บ้านทุ่งป่าดำ,Ban Thung Pa Dam,54011505,54011505,18.159557482584614,100.16558557748795
54011506,บ้านนาแหลม,Ban Na Laem,54011506,54011506,18.151908923666923,100.16592890024185
