id,name.th,name.en,name.slug,code.dopa,geo.lat,geo.lon
34050401,บ้านเจียด,Ban Chiat,34050401,34050401,15.868054022576997,105.22073417901993
34050402,บ้านนานวน,Ban Na Nuan,34050402,34050402,15.884200308857032,105.23199409246445
34050403,บ้านนาหนองเชือก,Ban Na Nong Chueak,34050403,34050403,15.84545582195974,105.21484270691872
34050404,บ้านนาตาปอ,Ban Na Ta Po,34050404,34050404,16.041004672476554,105.20640715956688
34050405,บ้านดอนติ้ว,Ban Don Tio,34050405,34050405,15.860991147444961,105.21146312355995
34050406,บ้านดอนแสนพัน,Ban Don Saen Phan,34050406,34050406,15.88761463692438,105.21747395396233
34050407,บ้านโคกค่าย,Ban Khok Khai,34050407,34050407,15.868508102156206,105.22919923067093
34050408,บ้านม่วงเจียด,Ban Muang Chiat,34050408,34050408,15.863337726464394,105.21607920527458
34050409,บ้านภูเขาเงิน,Ban Phu Khao Ngoen,34050409,34050409,15.813483504206161,105.16670778393745
