id,name.th,name.en,name.slug,code.dopa,geo.lat,geo.lon
11041450,ชุมชนร่วมศรัทธาพัฒนา,,11041450,11041450,13.651779680028584,100.593251734972
11041451,ชุมชนบุญถนอมพัฒนา,,11041451,11041451,13.652067690534968,100.5885498225689
11041452,ชุมชนบางวัวพัฒนา,,11041452,11041452,13.66650555826958,100.5811858177185
11041453,ชุมชนมหาวงษ์พัฒนา,,11041453,11041453,13.655105463193324,100.5834348499775
11041454,ชุมชนร่วมรังสรรค์,,11041454,11041454,13.65640083783266,100.58149829506874
11041455,ชุมชนเปรมฤทัย,,11041455,11041455,13.65881172742037,100.57946115732193
11041456,ชุมชนกุศลส่งสามัคคี,,11041456,11041456,13.659210499214096,100.59025034308434
