id,name.th,name.en,name.slug,code.dopa,geo.lat,geo.lon
12020501,บ้านบางขุนกอง,Ban Bang Khun Kong,12020501,12020501,13.81773118741308,100.45186847448349
12020502,บ้านวัดซองพลู,Ban Wat Song Phlu,12020502,12020502,13.82239335148366,100.45073255896568
12020503,บ้านวัดไทยเจริญ,Ban Wat Thai Charoen,12020503,12020503,13.826146455977213,100.45559540390968
12020504,บ้านบางนายไกร,Ban Bang Nai Krai,12020504,12020504,13.81831591646053,100.43851241469383
12020505,บ้านวัดอุทยาน,Ban Wat Uthayan,12020505,12020505,13.823091365781258,100.42804107069969
12020506,บ้านบางราวนก,Ban Bang Rao Nok,12020506,12020506,13.822830912929826,100.42808398604393
