id,name.th,name.en,name.slug,code.dopa,geo.lat,geo.lon
30130901,บ้านหันห้วยทราย,Ban Han Huai Sai,30130901,30130901,15.63182181080525,102.65127316117287
30130902,บ้านหนองช่องแมว,Ban Nong Chong Maeo,30130902,30130902,15.633330278600772,102.64541521668434
30130903,บ้านเพ็ดน้อย,Ban Phet Noi,30130903,30130903,15.601319449349296,102.6405443251133
30130904,บ้านโนนหญ้านาง,Ban Non Ya Nang,30130904,30130904,15.595697922877946,102.66071453690529
30130905,บ้านหนองม่วงใหญ่,Ban Nong Muang Yai,30130905,30130905,15.604047487577247,102.67307415604591
30130906,บ้านดอนกลอย,Ban Don Kloi,30130906,30130906,15.585741036355815,102.65870958566666
30130907,บ้านหลุ่งจาน,Ban Lung Chan,30130907,30130907,15.627324754399721,102.68389016389847
30130908,บ้านโกรกหิน,Ban Krok Hin,30130908,30130908,15.622704901226188,102.67354622483253
30130909,บ้านชลประทาน,Ban Chon Prathan,30130909,30130909,15.631953543880938,102.65101701021194
