id,name.th,name.en,name.slug,code.dopa,geo.lat,geo.lon
41181201,บ้านสามัคคี,Ban Samakkhi,41181201,41181201,17.779494346128963,102.30454936623573
41181202,บ้านโชคชัยสามัคคี,Ban Chok Chai Samakkhi,41181202,41181202,17.777521290416303,102.29981526732445
41181203,บ้านผากลางนา,Ban Pha Klang Na,41181203,41181203,17.750850336862932,102.26785272359848
41181204,บ้านผากลางนา,Ban Pha Klang Na,41181204,41181204,17.75496816358074,102.27404460310936
41181205,บ้านสวัสดี,Ban Sawat Di,41181205,41181205,17.740950050056924,102.30543717741966
41181206,บ้านโชคอำนวย,Ban Chok Amnuai,41181206,41181206,17.704870876097793,102.28863447904587
41181207,บ้านห้วยเจริญ,Ban Huai Charoen,41181207,41181207,17.706977599647974,102.2861547768116
41181208,บ้านศรีวิไล,Ban Si Wilai,41181208,41181208,17.776029671378414,102.29865789413452
