id,name.th,name.en,name.slug,code.dopa,geo.lat,geo.lon
53020501,บ้านข่อยสูง,Ban Khoi Sung,53020501,53020501,17.490021,99.989555
53020502,บ้านแหลมทอง,Ban Laem Thong,53020502,53020502,17.497379,99.9615877
53020503,บ้านไผ่ลูกช้าง,Ban Phai Luk Chang,53020503,53020503,17.4782442,100.0066677
53020504,บ้านดงจันทร์,Ban Dong Chan,53020504,53020504,17.466140,100.005486
53020505,บ้านแหลมถ่อน,Ban Laem Thon,53020505,53020505,17.479889,100.003872
53020506,บ้านสักลาย,Ban Sak Lai,53020506,53020506,17.5199287,99.9364211
53020507,บ้านข่อยสูงใต้,Ban Khoi Sung Tai,53020507,53020507,17.486432,99.991988
53020508,บ้านปลายรางบน,Ban Plai Rang Bon,53020508,53020508,17.474696,99.997841
