id,name.th,name.en,name.slug,code.dopa,geo.lat,geo.lon
35090501,บ้านคำไผ่ใต้,Ban Kham Phai Tai,35090501,35090501,16.060414372694243,104.52776804566383
35090502,บ้านโนนหนองผือ,Ban Non Nong Phue,35090502,35090502,16.057026188826796,104.52872425317764
35090503,บ้านหนองนกเขียน,Ban Nong Nok Khian,35090503,35090503,16.062310132416535,104.48052763938904
35090504,บ้านคำไผ่เหนือ,Ban Kham Phai Nuea,35090504,35090504,16.069140388170783,104.52732279896736
35090505,บ้านหนองสองห้อง,Ban Nong Song Hong,35090505,35090505,16.073237140373582,104.46113660931587
35090506,บ้านพอก,Ban Phok,35090506,35090506,16.05415346893049,104.5302115380764
35090507,บ้านโสกน้ำใส,Ban Sok Nam Sai,35090507,35090507,16.081849194482725,104.48141545057297
35090508,บ้านโนนบ้านใหม่,Ban Non Ban Mai,35090508,35090508,16.059349852519823,104.52631562948227
35090509,บ้านทรัพย์เจริญ,Ban Sap Charoen,35090509,35090509,16.059463264141105,104.45631936192513
