id,name.th,name.en,name.slug,code.dopa,geo.lat,geo.lon
65060401,บ้านมะตูม,Ban Matum,65060401,65060401,13.72706875088845,100.5340875685215
65060402,บ้านท่าไชย,Ban Tha Chai,65060402,65060402,13.72706875088845,100.5340875685215
65060403,บ้านไผ่ขอน้ำ,Ban Phai Kho Nam,65060403,65060403,13.72706875088845,100.5340875685215
65060404,บ้านไผ่ขอน้ำ,Ban Phai Kho Nam,65060404,65060404,16.942108,100.199626
65060405,บ้านวังปลาดุก,Ban Wang Pla Duk,65060405,65060405,16.940804429759044,100.1424166560173
65060406,บ้านแหลมลาด,Ban Laem Lat,65060406,65060406,16.93903785572088,100.22068619728088
