id,name.th,name.en,name.slug,code.dopa,geo.lat,geo.lon
51010401,บ้านหัวฝาย,Ban Hua Fai,51010401,51010401,18.667591741956755,99.01801586151123
51010402,บ้านหนองช้างคืน,Ban Nong Chang Khuen,51010402,51010402,18.653369868719313,99.01244223117828
51010403,บ้านหัวฝาย,Ban Hua Fai,51010403,51010403,18.667387183126056,99.012750685215
51010404,บ้านหนองช้างคืน,Ban Nong Chang Khuen,51010404,51010404,18.65258714190219,99.01767522096634
51010405,บ้านน้ำโค้ง,Ban Nam Khong,51010405,51010405,18.643328836304057,99.00676801800728
51010406,บ้านริมเหมือง,Ban Rim Mueang,51010406,51010406,18.63528617901725,99.01084363460541
