id,name.th,name.en,name.slug,code.dopa,geo.lat,geo.lon
20010901,บ้านชากสมอ,Ban Chak Samo,20010901,20010901,13.415527248785942,101.05122283101082
20010902,บ้านหนองไผ่กลางดอน,Ban Nong Phai Klang Don,20010902,20010902,13.415447673672489,101.05102971196175
20010903,บ้านหนองกงฉาก,Ban Nong Kong Chak,20010903,20010903,13.72706875088845,100.5340875685215
20010904,บ้านดอนบน,Ban Don Bon,20010904,20010904,13.416910025236556,101.04377299547195
20010905,บ้านดอนหัวฬ่อ,Ban Don Hua Lo,20010905,20010905,13.72706875088845,100.5340875685215
20010906,บ้านดอนล่าง,Ban Don Lang,20010906,20010906,13.422381045692095,101.03494584560394
20010907,บ้านมาบสามเกลียว,Ban Map Sam Kliao,20010907,20010907,13.437966378364424,101.05227023363113
