id,name.th,name.en,name.slug,code.dopa,geo.lat,geo.lon
50051001,บ้านแม่ก๊ะเหนือ,Ban Mae Ka Nuea,50051001,50051001,18.817295465514345,99.11642476916313
50051002,บ้านแม่ก๊ะตลาด,Ban Mae Ka Talat,50051002,50051002,18.81118307271786,99.1217315196991
50051003,บ้านแม่ก๊ะใต้,Ban Mae Ka Tai,50051003,50051003,18.803572420658984,99.11462768912315
50051004,บ้านแม่จ้องใต้,Ban Mae Chong Tai,50051004,50051004,18.80877740757274,99.1265769302845
50051005,บ้านแม่จ้องเหนือ,Ban Mae Chong Nuea,50051005,50051005,18.812330670776326,99.13236781954765
