id,name.th,name.en,name.slug,code.dopa,geo.lat,geo.lon
38011201,บ้านห้วยกกต้อง,Ban Huai Kok Tong,38011201,38011201,18.315499791420763,103.52675691246986
38011202,บ้านโป่งเปือย,Ban Pong Pueai,38011202,38011202,18.321025238557198,103.5306890308857
38011203,บ้านสมัยสำราญ,Ban Samai Samran,38011203,38011203,18.32510300724069,103.53072792291641
38011204,บ้านโนนศรีทอง,Ban Non Si Thong,38011204,38011204,18.32278977966814,103.53095725178719
38011205,บ้านหนองบัวบาน,Ban Nong Bua Ban,38011205,38011205,18.326474124228184,103.51925745606422
38011206,บ้านห้วยสามยอดเทวกุล,Ban Huai Sam Yot Theo Kun,38011206,38011206,18.350013119532512,103.55751916766167
38011207,บ้านหนองตะไก้,Ban Nong Takai,38011207,38011207,18.347782965538286,103.51234003901482
