id,name.th,name.en,name.slug,code.dopa,geo.lat,geo.lon
50121501,บ้านสันทรายมูล,Ban San Sai Mun,50121501,50121501,18.58676420061465,98.90417084097862
50121502,บ้านขุนคง,Ban Khun Khong,50121502,50121502,18.576655674121167,98.9051578938961
50121503,บ้านพระบาท,Ban Phra Bat,50121503,50121503,18.578392166365138,98.89556229114532
50121504,บ้านม่วงพี่น้อง,Ban Muang Phi Nong,50121504,50121504,18.569850640574675,98.90034198760986
50121505,บ้านมะขุนหวาน,Ban Makhun Wan,50121505,50121505,18.578066734319293,98.91116470098495
50121506,บ้านดงป่าซาง,Ban Dong Pa Sang,50121506,50121506,18.56090821281536,98.9141795039177
50121507,บ้านดงป่างิ้ว,Ban Dong Pa Ngio,50121507,50121507,18.55436954457614,98.90567153692245
50121508,บ้านพระเจ้าสององค์,Ban Phra Chao Song Ong,50121508,50121508,18.56857681185565,98.89134988188744
