id,name.th,name.en,name.slug,code.dopa,geo.lat,geo.lon
15040401,บ้านหนองแม่ไก่,Ban Nong Mae Kai,15040401,15040401,14.70601747770452,100.35401746630669
15040402,บ้านไร่แตงโม,Ban Rai Taeng Mo,15040402,15040402,14.699829882477006,100.34101277589798
15040403,บ้านกลาง,Ban Klang,15040403,15040403,14.714623,100.362370
15040404,บ้านแก,Ban Kae,15040404,15040404,14.707495,100.335112
15040405,บ้านเตาเหล็ก,Ban Tao Lek,15040405,15040405,14.703672,100.332066
15040406,บ้านหัวทองดี,Ban Hua Thong Di,15040406,15040406,14703672,100.332066
15040407,บ้านริ้วหว้า,Ban Rio Wan,15040407,15040407,14.702647,100.295420
