id,name.th,name.en,name.slug,code.dopa,geo.lat,geo.lon
63040201,บ้านแม่จะเราบ้านทุ่ง,Ban Mae Charao Ban Thung,63040201,63040201,16.962879432477408,98.57419073581696
63040202,บ้านแม่จะเราสองแคว,Ban Mae Charao Song Khaeo,63040202,63040202,16.962231638377304,98.57877865433693
63040203,บ้านแม่จะเราสองแคว,Ban Mae Charao Song Khaeo,63040203,63040203,16.959807201029367,98.58875244855881
63040204,บ้านวังผา,Ban Wang Pha,63040204,63040204,16.835937223590104,98.54299530386925
63040205,บ้านทุ่งหลวง,Ban Thung Luang,63040205,63040205,16.95670284933125,98.57352152466774
63040206,บ้านแม่จะเราบ้านทุ่ง,Ban Mae Charao Ban Thung,63040206,63040206,16.9545644086398,98.56937751173972
63040207,บ้านห้วยบงใหม่,Ban Huai Bong Mai,63040207,63040207,16.879935956102756,98.57656851410866
63040208,บ้านห้วยบง,Ban Huai Bong,63040208,63040208,16.875169632640162,98.57548221945763
63040209,บ้านใหม่,Ban Mai,63040209,63040209,16.96642622591707,98.56795325875282
