id,name.th,name.en,name.slug,code.dopa,geo.lat,geo.lon
82070601,บ้านบางเหรียงใน,Ban Bang Riang Nai,82070601,82070601,8.584800559015395,98.66306439042091
82070602,บ้านบางเหรียงใต้,Ban Bang Riang Tai,82070602,82070602,8.578329239350756,98.66273179650307
82070603,บ้านคอกช้าง,Ban Khok Chang,82070603,82070603,8.5791461169316,98.6591349542141
82070604,บ้านบางเหรียงเหนือ,Ban Bang Riang Nuea,82070604,82070604,8.594974099103652,98.66823300719261
82070605,บ้านปากด่าน,Ban Pak Dan,82070605,82070605,8.608886689177979,98.6714194715023
