id,name.th,name.en,name.slug,code.dopa,geo.lat,geo.lon
90111101,บ้านหัวนอนถนน,Ban Hua Non Thanon,90111101,90111101,7.057149258547308,100.52289605140686
90111102,บ้านทุ่งใหญ่,Ban Thung Yai,90111102,90111102,7.057955810171561,100.52835166454315
90111103,บ้านนายด่าน,Ban Nai Dan,90111103,90111103,7.0514940411055,100.54118067026138
90111104,บ้านพรุเตาะนอก,Ban Phru To Nok,90111104,90111104,7.042123983112956,100.5367362499237
90111105,บ้านพรุเตาะใน,Ban Phru To Nai,90111105,90111105,7.036455272305859,100.54032236337662
90111106,บ้านทุ่งงาย,Ban Thung Ngai,90111106,90111106,7.004230552132555,100.53667590022087
