id,name.th,name.en,name.slug,code.dopa,geo.lat,geo.lon
20060301,บ้านคลองนอกทุ่ง,Ban Khlong Mok Thung,20060301,20060301,13.508960203343111,101.16793915629387
20060302,บ้านต้นโพธิ์,Ban Ton Pho,20060302,20060302,13.508289946037863,101.16695210337639
20060303,บ้านไร่ยายชี,Ban Rai Yai Chi,20060303,20060303,13.498812253998254,101.16959407925606
20060304,บ้านหัวโขด,Ban Hua Khot,20060304,20060304,13.509755642447834,101.16746038198471
20060305,บ้านดอนพระพราหมณ์,Ban Don Phra Phram,20060305,20060305,13.51127088140139,101.16301864385605
20060306,บ้านดอนตาอุ้ย,Ban Don Ta Ui,20060306,20060306,13.50601835960526,101.16546079516411
20060307,บ้านดอนสะแก,Ban Don Sakae,20060307,20060307,13.5085377067398,101.16699770092964
