id,name.th,name.en,name.slug,code.dopa,geo.lat,geo.lon
81080501,บ้านนาเหนือ,Ban Na Nuea,81080501,81080501,8.08080942084041,99.05380725860596
81080502,บ้านห้วยแทงงู,Ban Huai Thaeng Ngu,81080502,81080502,8.07144574840731,99.08624589443207
81080503,บ้านควนนกหว้า,Ban Khuan Nok Wa,81080503,81080503,8.119806006800344,99.08955708146095
81080504,บ้านโคกยาง,Ban Khok Yang,81080504,81080504,8.080505357180762,99.07225012779236
81080505,บ้านบางผึ้ง,Ban Bang Phueng,81080505,81080505,8.045827321304554,99.08233255147934
81080506,บ้านนาหลวง,Ban Na Luang,81080506,81080506,8.0908473762974,99.06309440732002
81080507,บ้านควนเกาะจันทร์,Ban Khuan Ko Chan,81080507,81080507,8.081683104666082,99.08869609236717
