id,name.th,name.en,name.slug,code.dopa,geo.lat,geo.lon
57050401,บ้านดอยชัยมงคล,Ban Doi Chai Mongkhon,57050401,57050401,19.575063910842463,99.7502575814724
57050402,บ้านป่าหมุ้น,Ban Pa Mun,57050402,57050402,19.58468714899689,99.74926114082336
57050403,บ้านไร่อ้อย,Ban Rai Oi,57050403,57050403,19.588313403921752,99.76338967680931
57050404,บ้านสันกอเหียง,Ban San Ko Hiang,57050404,57050404,19.56859292029613,99.76235166192055
57050405,บ้านสันกอตาล,Ban San Ko Tan,57050405,57050405,19.576240311789125,99.77453157305717
57050406,บ้านเหมืองง่า,Ban Mueang Nga,57050406,57050406,19.57273761902423,99.79365035891533
57050407,บ้านท่าต้นเกี๋ยง,Ban Tha Ton Kiang,57050407,57050407,19.575899143763003,99.7999857366085
57050408,บ้านโชคชัย,Ban Chok Chai,57050408,57050408,19.578671428954976,99.79013800621033
57050409,บ้านป่าก่อ,Ban Pa Ko,57050409,57050409,19.568038179665546,99.79435846209526
