id,name.th,name.en,name.slug,code.dopa,geo.lat,geo.lon
50190401,บ้านต้นโชคหลวง,Ban Ton Chok Luang,50190401,50190401,18.72735045900228,99.04513701796532
50190402,บ้านศรีสองเมือง,Ban Si Song Mueang,50190402,50190402,18.733830398109223,99.04393807053566
50190403,บ้านศรีบุญเรือง,Ban Si Bun Rueang,50190403,50190403,18.737063924320367,99.04247894883156
50190404,บ้านต้นยางหลวง,Ban Ton Yang Luang,50190404,50190404,18.74212364630407,99.0437288582325
50190405,บ้านยวม,Ban Yuam,50190405,50190405,18.757874616205697,99.04813036322594
50190406,บ้านโพธิมงคล,Ban Pho Mongkhon,50190406,50190406,18.76174133519332,99.04142752289772
50190407,บ้านเชียงขาง,Ban Chiang Khang,50190407,50190407,18.750393628495484,99.03872385621071
50190408,บ้านต้นยางหลวง,Ban Ton Yang Luang,50190408,50190408,18.74733561103252,99.0479077398777
