id,name.th,name.en,name.slug,code.dopa,geo.lat,geo.lon
63090201,บ้านลาดยาว,Ban Lat Yao,63090201,63090201,16.702850862452337,99.17936012148857
63090202,บ้านเพชรชมภู,Ban Phet Chomphu,63090202,63090202,16.707243231104314,99.11066740751266
63090203,บ้านตะเคียนด้วน,Ban Takhian Duan,63090203,63090203,16.717561913291686,99.190424233675
63090204,บ้านนาโบสถ์,Ban Na Bot,63090204,63090204,16.690458687430798,99.15386706590652
63090205,บ้านวังตำลึง,Ban Wang Tam Lueng,63090205,63090205,16.694384397610975,99.15960028767586
63090206,บ้านใหม่พรสวรรค์,Ban Mai Phon Sawan,63090206,63090206,16.724298265993237,99.09938737750052
63090207,บ้านท่าทองแดง,Ban Tha Thong Daeng,63090207,63090207,16.673406732756163,99.1416110470891
63090208,บ้านวังน้ำเย็น,Ban Wang Nam Yen,63090208,63090208,16.66307635122636,99.1038804128766
63090209,บ้านนาแพะ,Ban Na Phae,63090209,63090209,16.684741470818693,99.12434365600348
