id,name.th,name.en,name.slug,code.dopa,geo.lat,geo.lon
63040601,บ้านห้วยนกแลเหนือ,Ban Huai Nok Lae Nuea,63040601,63040601,17.015853723184485,98.59122678637505
63040602,บ้านตีนธาตุ,Ban Tin That,63040602,63040602,13.72706875088845,100.5340875685215
63040603,บ้านป่าไร่เหนือ,Ban Pa Rai Nuea,63040603,63040603,13.744410965779048,100.53683415055275
63040604,บ้านทุ่งมะขามป้อม,Ban Thung Makham Pom,63040604,63040604,16.971035033192162,98.58907699584961
63040605,บ้านสันป่าไร่,Ban San Pa Rai,63040605,63040605,16.96151713813549,98.61396923661232
63040606,บ้านพระกอยวา,Ban Phra Koi Wa,63040606,63040606,13.790428307667085,100.57116642594337
63040607,บ้านดอยเป๊ก,Ban Doi Pek,63040607,63040607,13.72706875088845,100.5340875685215
63040608,บ้านห้วยสลุง,Ban Huai Salung,63040608,63040608,16.980914149220506,98.60442191362381
