id,name.th,name.en,name.slug,code.dopa,geo.lat,geo.lon
65090701,บ้านคลองตะเคียน,Ban Khlong Takhian,65090701,65090701,16.439176133192987,100.76325014233589
65090702,บ้านไทรดงยั้ง,Ban Sai Dong Yang,65090702,65090702,16.434578910156937,100.74041917920113
65090703,บ้านวังดินเหนียว,Ban Wang Din Niao,65090703,65090703,16.442210446580567,100.68468824028969
65090704,บ้านหนองชาละวัน,Ban Nong Cha La Wan,65090704,65090704,16.465728303608724,100.70231705904007
65090705,บ้านทุ่งนาดี,Ban Thung Na Di,65090705,65090705,16.461241031083997,100.73217809200287
65090706,บ้านวังยาง,Ban Wang Yang,65090706,65090706,16.462299517166777,100.72377607226372
65090707,บ้านวังยางใต้,Ban Wang Yang Tai,65090707,65090707,16.45147001859475,100.71943491697311
