id,name.th,name.en,name.slug,code.dopa,geo.lat,geo.lon
22040901,บ้านเนินดินแดง,Ban Noen Din Daeng,22040901,22040901,13.001697344856233,102.49205321073532
22040902,บ้านเทพนิมิต,Ban Thep Nimit,22040902,22040902,13.002463083439498,102.45099261403084
22040903,บ้านบึงชนังกลาง,Ban Bueng Chanang Klang,22040903,22040903,13.036362286320625,102.4591451883316
22040904,บ้านแหลม,Ban Laem,22040904,22040904,13.082677415412464,102.4455638229847
22040905,บ้านบึงชนังบน,Ban Bueng Chanang Bon,22040905,22040905,13.044328134667465,102.4721297621727
22040906,บ้านบึงชนังบน,Ban Bueng Chanang Bon,22040906,22040906,13.033287977753231,102.45597615838051
22040907,บ้านหนองกก,Ban Nong Kok,22040907,22040907,13.004855674603908,102.50237837433815
22040908,บ้านแหลมใหม่,Ban Laem Yai,22040908,22040908,13.084565005038252,102.41311579942703
