id,name.th,name.en,name.slug,code.dopa,geo.lat,geo.lon
71020401,บ้านแก่งประลอม,Ban Kaeng Pralom,71020401,71020401,14.37542768826667,98.88117894530296
71020402,บ้านท่าทุ่งนา,Ban Tha Thung Na,71020402,71020402,14.500889394743163,98.83580535650253
71020403,บ้านทุ่งก้างย่าง,Ban Thung Kang Yang,71020403,71020403,14.419121716343893,98.89478176832199
71020404,บ้านแก่งจอ,Ban Kaeng Cho,71020404,71020404,14.503934079495965,98.80432024598122
71020405,บ้านแม่น้ำน้อย,Ban Mae Nam Noi,71020405,71020405,14.421888270678298,98.84448766708374
71020406,บ้านดาวดึงส์,Ban Dao Dueng,71020406,71020406,14.477482227430036,98.83777007460594
71020407,บ้านวังนกแก้ว,Ban Wang Nokkaeo,71020407,71020407,14.454411539747777,98.86225059628487
71020408,บ้านท่าเตียน,Ban Tha Tian,71020408,71020408,14.530373685324076,98.80011051893234
